{
  "schema_version": "execution-request-v1",
  "id": "joga-hairbands-product-hero",
  "subject": {
    "product_name": "JOGA hairband",
    "brand": "JOGA"
  },
  "reference": {
    "image": "reference/flatlay.png",
    "optional": true
  },
  "output": {
    "imgtype": "hero",
    "aspect_ratio": "1:1",
    "resolution": "2k",
    "count": 1,
    "background": "neutral studio grey, seamless, soft gradient",
    "composition": "band laid flat, slight three-quarter angle, wordmark legible and unoccluded"
  },
  "engine": {
    "name": "higgsfield",
    "model": "nano_banana_2"
  },
  "dry_run": true,
  "parent_run_id": null,
  "provenance": {
    "compiled_from": "job-v1",
    "source_job_path": "/Users/craigkunte/.local/state/sdk-executor/worktrees/sdk-executor-9f81572b0b2d/services/aragon/image-pipeline/jobs/joga-hairbands/product-hero.job.json"
  }
}
