{
  "schema_version": "execution-request-v1",
  "id": "starz-kid-images-hero",
  "subject": {
    "product": "kids' athletic shoe",
    "view": "three-quarter hero angle on a seamless studio backdrop"
  },
  "reference": "reference/plates/plate-hero.png",
  "output": {
    "imgtype": "hero",
    "aspect_ratio": "4:3",
    "resolution": "2k",
    "dir": "out",
    "count": 1
  },
  "engine": {
    "name": "higgsfield",
    "model": "nano_banana_2"
  },
  "dry_run": true,
  "parent_run_id": null,
  "provenance": {
    "compiled_from": "job-v1",
    "source_job_path": "/Users/craigkunte/.local/state/sdk-executor/worktrees/sdk-executor-92b4bfb7f159/jobs/starz-kid-images/kid-hero.job.json"
  }
}
