{
  "schema_version": "execution-request-v1",
  "id": "joga-hairbands-edit-logo-fix",
  "subject": {
    "operation": "replace_logo"
  },
  "reference": [
    {
      "image": "reference/parent-shot-1-base.png",
      "optional": true
    },
    {
      "image": "reference/joga-chest-logo-stacked-yellow.png",
      "optional": true
    }
  ],
  "output": {
    "imgtype": "edit",
    "resolution": "2k",
    "count": 1
  },
  "engine": {
    "name": "higgsfield",
    "model": "nano_banana_2"
  },
  "dry_run": true,
  "parent_run_id": null,
  "provenance": {
    "compiled_from": "job-v1",
    "source_job_path": "/Users/craigkunte/.local/state/sdk-executor/worktrees/sdk-executor-9f81572b0b2d/services/aragon/image-pipeline/jobs/joga-hairbands/edit-logo-fix.job.json"
  }
}
