{
  "schema_version": "execution-request-v1",
  "id": "joga-hairbands-starz-kid-campaign",
  "subject": {
    "campaign": "Starz Kid",
    "audience": "youth_athletics",
    "mood": "energetic"
  },
  "reference": {
    "image": "reference/flatlay.png",
    "optional": true
  },
  "output": {
    "imgtype": "hero",
    "aspect_ratio": "4:3",
    "resolution": "2k",
    "count": 1,
    "background": "neutral studio grey backdrop",
    "composition": "subject centered, band readable, chest mark optional"
  },
  "engine": {
    "name": "higgsfield",
    "model": "nano_banana_2"
  },
  "dry_run": true,
  "parent_run_id": null,
  "provenance": {
    "compiled_from": "job-v1",
    "source_job_path": "/Users/craigkunte/.local/state/sdk-executor/worktrees/sdk-executor-9f81572b0b2d/services/aragon/image-pipeline/jobs/joga-hairbands/starz-kid-campaign.job.json"
  }
}
